{
    "$schema": "http://json-schema.org/draft-07/schema#",
    "$id": "https://grafana.com/schemas/datasource-config-schema.json",
    "title": "Datasource Configuration Schema",
    "description": "Declarative schema for Grafana datasource configuration including UI, validation, behavior, relationships, and storage mapping.",
    "type": "object",
    "required": [
        "schemaVersion",
        "pluginType",
        "pluginName",
        "fields"
    ],
    "properties": {
        "schemaVersion": {
            "type": "string",
            "description": "Version of this schema specification",
            "examples": [
                "v1",
                "v2"
            ]
        },
        "pluginType": {
            "type": "string",
            "description": "Unique identifier of the datasource plugin"
        },
        "pluginName": {
            "type": "string",
            "description": "Human readable name"
        },
        "docURL": {
            "type": "string",
            "format": "uri"
        },
        "fields": {
            "type": "array",
            "description": "Source of truth for all config fields",
            "items": {
                "$ref": "#/definitions/ConfigField"
            }
        },
        "groups": {
            "type": "array",
            "items": {
                "$ref": "#/definitions/ConfigGroup"
            }
        },
        "relationships": {
            "type": "array",
            "items": {
                "$ref": "#/definitions/FieldRelationship"
            }
        }
    },
    "definitions": {
        "ConfigField": {
            "type": "object",
            "title": "Config Field",
            "required": [
                "id",
                "key",
                "valueType"
            ],
            "properties": {
                "id": {
                    "type": "string",
                    "description": "Globally unique identifier. Recommended format: dot-separated path (e.g. 'auth.method', 'httpHeaders.item.key')"
                },
                "key": {
                    "type": "string",
                    "description": "Local key"
                },
                "label": {
                    "type": "string"
                },
                "description": {
                    "type": "string"
                },
                "docURL": {
                    "type": "string",
                    "format": "uri"
                },
                "valueType": {
                    "type": "string",
                    "enum": [
                        "string",
                        "number",
                        "boolean",
                        "array",
                        "object"
                    ]
                },
                "semanticType": {
                    "type": "string",
                    "enum": [
                        "url",
                        "password",
                        "token",
                        "hostname",
                        "duration"
                    ]
                },
                "target": {
                    "type": "string",
                    "enum": [
                        "root",
                        "jsonData",
                        "secureJsonData"
                    ],
                    "description": "Storage location. Required for storage fields."
                },
                "kind": {
                    "type": "string",
                    "enum": [
                        "storage",
                        "virtual"
                    ],
                    "default": "storage"
                },
                "isItemField": {
                    "type": "boolean",
                    "description": "Must be true for fields inside array item schemas"
                },
                "lifecycle": {
                    "type": "string",
                    "enum": [
                        "stable",
                        "deprecated",
                        "experimental"
                    ]
                },
                "ui": {
                    "$ref": "#/definitions/FieldUI"
                },
                "validations": {
                    "type": "array",
                    "items": {
                        "$ref": "#/definitions/FieldValidationRule"
                    }
                },
                "dependsOn": {
                    "type": "string"
                },
                "required": {
                    "type": "boolean"
                },
                "requiredWhen": {
                    "type": "string"
                },
                "disabledWhen": {
                    "type": "string"
                },
                "overrides": {
                    "type": "array",
                    "items": {
                        "$ref": "#/definitions/FieldOverride"
                    }
                },
                "item": {
                    "$ref": "#/definitions/FieldItemSchema"
                },
                "repeatable": {
                    "type": "boolean",
                    "description": "Legacy indexed fields. Prefer indexedPair mapping.",
                    "default": false
                },
                "pattern": {
                    "type": "string",
                    "description": "Pattern for repeatable fields (legacy)"
                },
                "storage": {
                    "$ref": "#/definitions/StorageMapping"
                },
                "tags": {
                    "type": "array",
                    "items": {
                        "type": "string"
                    }
                },
                "examples": {
                    "type": "array",
                    "items": {}
                },
                "defaultValue": {}
            },
            "allOf": [
                {
                    "if": {
                        "properties": {
                            "kind": {
                                "const": "virtual"
                            }
                        }
                    },
                    "then": {
                        "not": {
                            "required": [
                                "target"
                            ]
                        }
                    }
                },
                {
                    "if": {
                        "properties": {
                            "isItemField": {
                                "const": true
                            }
                        }
                    },
                    "then": {
                        "not": {
                            "required": [
                                "target"
                            ]
                        }
                    }
                },
                {
                    "if": {
                        "not": {
                            "anyOf": [
                                {
                                    "properties": {
                                        "kind": {
                                            "const": "virtual"
                                        }
                                    }
                                },
                                {
                                    "properties": {
                                        "isItemField": {
                                            "const": true
                                        }
                                    }
                                }
                            ]
                        }
                    },
                    "then": {
                        "required": [
                            "target"
                        ]
                    }
                },
                {
                    "if": {
                        "properties": {
                            "valueType": {
                                "const": "array"
                            }
                        }
                    },
                    "then": {
                        "required": [
                            "item"
                        ]
                    }
                }
            ]
        },
        "FieldItemSchema": {
            "type": "object",
            "required": [
                "valueType"
            ],
            "properties": {
                "valueType": {
                    "type": "string",
                    "enum": [
                        "string",
                        "number",
                        "boolean",
                        "array",
                        "object"
                    ]
                },
                "fields": {
                    "type": "array",
                    "items": {
                        "allOf": [
                            {
                                "$ref": "#/definitions/ConfigField"
                            },
                            {
                                "properties": {
                                    "isItemField": {
                                        "const": true
                                    }
                                },
                                "required": [
                                    "isItemField"
                                ]
                            }
                        ]
                    }
                }
            }
        },
        "StorageMapping": {
            "oneOf": [
                {
                    "$ref": "#/definitions/DirectMapping"
                },
                {
                    "$ref": "#/definitions/IndexedPairMapping"
                },
                {
                    "$ref": "#/definitions/ComputedMapping"
                }
            ]
        },
        "DirectMapping": {
            "type": "object",
            "required": [
                "type"
            ],
            "properties": {
                "type": {
                    "const": "direct"
                }
            }
        },
        "IndexedPairMapping": {
            "type": "object",
            "required": [
                "type",
                "key",
                "value"
            ],
            "properties": {
                "type": {
                    "const": "indexedPair"
                },
                "key": {
                    "$ref": "#/definitions/MappingField"
                },
                "value": {
                    "$ref": "#/definitions/MappingField"
                },
                "startIndex": {
                    "type": "number"
                }
            }
        },
        "ComputedMapping": {
            "type": "object",
            "required": [
                "type"
            ],
            "properties": {
                "type": {
                    "const": "computed"
                },
                "read": {
                    "type": "string"
                },
                "write": {
                    "type": "string"
                }
            },
            "anyOf": [
                {
                    "required": [
                        "read"
                    ]
                },
                {
                    "required": [
                        "write"
                    ]
                }
            ]
        },
        "MappingField": {
            "type": "object",
            "required": [
                "target",
                "pattern"
            ],
            "properties": {
                "target": {
                    "type": "string",
                    "enum": [
                        "root",
                        "jsonData",
                        "secureJsonData"
                    ]
                },
                "pattern": {
                    "type": "string"
                }
            }
        },
        "FieldUI": {
            "type": "object",
            "required": [
                "component"
            ],
            "properties": {
                "component": {
                    "type": "string",
                    "enum": [
                        "input",
                        "textarea",
                        "select",
                        "multiselect",
                        "radio",
                        "checkbox",
                        "switch",
                        "code",
                        "keyvalue",
                        "list"
                    ]
                },
                "multiline": {
                    "type": "boolean"
                },
                "rows": {
                    "type": "number"
                },
                "options": {
                    "type": "array",
                    "items": {
                        "$ref": "#/definitions/FieldOption"
                    }
                },
                "allowCustom": {
                    "type": "boolean"
                },
                "width": {
                    "type": "string",
                    "enum": [
                        "full",
                        "half"
                    ]
                },
                "placeholder": {
                    "type": "string"
                }
            }
        },
        "FieldValidationRule": {
            "type": "object",
            "title": "Field Validation Rule",
            "description": "A single validation rule. Uses 'type' as discriminator.",
            "required": ["type"],
            "properties": {
                "id": {
                    "type": "string",
                    "description": "Optional stable ID for docs, localization, and test snapshots."
                },
                "message": {
                    "type": "string",
                    "description": "Human-readable validation error message."
                }
            },
            "oneOf": [
                {
                    "properties": {
                        "type": { "const": "pattern" },
                        "pattern": { "type": "string" }
                    },
                    "required": ["type", "pattern"]
                },
                {
                    "properties": {
                        "type": { "const": "range" },
                        "min": { "type": "number" },
                        "max": { "type": "number" }
                    },
                    "required": ["type"]
                },
                {
                    "properties": {
                        "type": { "const": "length" },
                        "min": { "type": "number" },
                        "max": { "type": "number" }
                    },
                    "required": ["type"]
                },
                {
                    "properties": {
                        "type": { "const": "itemCount" },
                        "min": { "type": "number" },
                        "max": { "type": "number" }
                    },
                    "required": ["type"]
                },
                {
                    "properties": {
                        "type": { "const": "allowedValues" },
                        "values": { "type": "array", "items": {} }
                    },
                    "required": ["type", "values"]
                },
                {
                    "properties": {
                        "type": { "const": "custom" },
                        "expression": { "type": "string" }
                    },
                    "required": ["type", "expression"]
                }
            ]
        },
        "FieldOverride": {
            "type": "object",
            "required": [
                "when"
            ],
            "properties": {
                "when": {
                    "type": "string"
                },
                "defaultValue": {},
                "description": {
                    "type": "string"
                },
                "placeholder": {
                    "type": "string"
                },
                "tooltip": {
                    "type": "string"
                },
                "validations": {
                    "type": "array",
                    "items": {
                        "$ref": "#/definitions/FieldValidationRule"
                    }
                },
                "options": {
                    "type": "array",
                    "items": {
                        "$ref": "#/definitions/FieldOption"
                    }
                }
            }
        },
        "FieldOption": {
            "type": "object",
            "required": [
                "label",
                "value"
            ],
            "properties": {
                "label": {
                    "type": "string"
                },
                "value": {
                    "description": "Must match parent field valueType"
                }
            }
        },
        "ConfigGroup": {
            "type": "object",
            "required": [
                "id",
                "title",
                "fieldRefs"
            ],
            "properties": {
                "id": {
                    "type": "string"
                },
                "title": {
                    "type": "string"
                },
                "description": {
                    "type": "string"
                },
                "order": {
                    "type": "number"
                },
                "fieldRefs": {
                    "type": "array",
                    "items": {
                        "type": "string"
                    }
                }
            }
        },
        "FieldRelationship": {
            "type": "object",
            "required": [
                "type",
                "fields"
            ],
            "properties": {
                "type": {
                    "type": "string",
                    "enum": [
                        "pair",
                        "group"
                    ]
                },
                "fields": {
                    "type": "array",
                    "items": {
                        "type": "string"
                    }
                },
                "description": {
                    "type": "string"
                }
            }
        }
    }
}
